### ISSUE TITLE
[Feat]:  Add `webRTCIPHandlingPolicy` config option to fix calls dropping to OnHold on multi-interface systems

### ISSUE THREAD

**Issue by Vagrantin** [IsmaelMartinez/teams-for-linux#2349]
### Describe the feature

This issue proposes a new configuration option `webRTCIPHandlingPolicy` that maps directly to Electron's `webContents.setWebRTCIPHandlingPolicy()` API to restrict ICE candidate gathering to the interface with the default route only.

## Summary

On Linux systems with multiple network interfaces (e.g. WiFi for internet + a secondary Ethernet adapter with no internet gateway), Microsoft Teams calls regularly drop to **OnHold** mid-call. This is caused by WebRTC gathering ICE candidates from all interfaces and sending STUN packets from an IP that has no valid internet route, creating an asymmetric path that the WebRTC engine cannot recover from.

---

## Environment

- **OS**: Pop!_OS (Ubuntu-based)
- **Network**: WiFi (`wlo1`, `192.168.50.1/24`, default route) + USB Ethernet adapter (`eth0`, `192.168.0.1/24`, no internet gateway)
- **teams-for-linux version**: 2.7.12

---

## Symptom

Calls drop to **OnHold** repeatedly during a session. The following errors appear in `journalctl`:

```
Port[...host:Net[eth0:192.168.0.x/24:Ethernet:id=1]]:
Received non-STUN packet from unknown address: 52.113.78.x:3478
```

---

### Step 1 — journalctl shows a WebRTC port error on the Ethernet interface

```
third_party/webrtc/p2p/base/port.cc:409
Received non-STUN packet from unknown address: 52.113.78.x:3478
```

The error originates from the Ethernet interface, which has no internet route. WebRTC gathered it as a host ICE candidate and sent a STUN binding request sourced from `192.168.0.1`. The kernel routed this packet out via WiFi (the default gateway), but the STUN server's reply was delivered back to the Ethernet interface by the remote end — creating an **asymmetric path**. WebRTC's port handler rejects the reply because it arrives on an unexpected socket, the candidate fails, ICE restarts, and Teams goes OnHold.

### Step 2 — tcpdump confirms the asymmetric routing

```
wlo1  Out  IP 192.168.0.1.47810    > 52.115.47.202.3478  (STUN from eth IP, out via WiFi)
wlo1  Out  IP 192.168.50.152.57271 > 52.115.47.202.3478  (STUN from WiFi IP, out via WiFi)
eth0 In  IP 52.115.47.202.3478 > 192.168.0.1.47810  (reply arrives on wrong interface)
```

The outbound packet for `192.168.0.1` leaves via `wlo1` (because the kernel follows the default route), but the STUN server remembers the source IP and routes its reply back to the Ethernet interface — which has no socket listening for it.

### Step 3 — Routing table confirms the Ethernet interface has no internet path

```
ip route
default via 192.168.50.1 dev wlo1 proto dhcp metric 100
192.168.0.0/24 dev eth0 proto kernel scope link src 192.168.0.1 metric 600
```

There is no default route on `eth0`. Any packet sourced from `192.168.0.1` destined for the internet will be routed via `wlo1`, but replies will return via `eth0` — a guaranteed asymmetric path for every STUN transaction on that candidate.

### Step 4 — WebRTC IP handling policy is the correct fix

Electron exposes `webContents.setWebRTCIPHandlingPolicy()` specifically to control which interfaces WebRTC gathers ICE candidates from. Setting it to `default_public_interface_only` restricts candidate gathering to the interface holding the default route (`wlo1`/`192.168.50.152`), completely eliminating the Ethernet candidate.

After applying the fix, `tcpdump` shows only the WiFi IP on port 3478, and the OnHold drops stop.

---

## Proposed Fix

Add a `webRTCIPHandlingPolicy` configuration option that:

1. Is declared in `app/config/index.js` as a yargs option with the four valid Chromium policy values as choices.
2. Is applied in `app/mainAppWindow/index.js` via `window.webContents.setWebRTCIPHandlingPolicy()` immediately after the `BrowserWindow` is created.

### Usage

Add to `~/.config/teams-for-linux/config.json`:

```json
{
  "webRTCIPHandlingPolicy": "default_public_interface_only"
}
```

### Available values

| Value | Behaviour |
|---|---|
| `default` | Enumerate all interfaces (current behaviour) |
| `default_public_and_private_interfaces` | Public and all private interfaces, WebRTC expose Public and private but should use only default route selected by the OS |
| `default_public_interface_only` | Public only, WebRTC should use only default route selected by the OS |
| `disable_non_proxied_udp` | Force TCP only (impacts call quality) |

---

## Affected Users

Anyone running teams-for-linux on a machine with:
- A secondary Ethernet adapter used for local networking (NAS, direct device link, VM bridge, etc.)
- WiFi as the sole internet-facing interface
- Both interfaces active simultaneously during calls

### Additional context

This troubleshooting was done with done with help of LLMs ( essentially claude.ai) 
The proposed feature has been tested and proven working on my machine.

**Comment by IsmaelMartinez** [comment]
Thanks for the feature request and thorough investigation @Vagrantin. 

This feature doesn't exist yet in the current codebase (v2.7.12), so upgrading from v2.6.3 won't help here, but I do recommend moving to 2.7.12 nevertheless. 

You may be able to test this right now using the existing electronCLIFlags config option. Chromium exposes a `force-webrtc-ip-handling-policy` switch that should produce the same ICE candidate filtering. Add this to your  `~/.config/teams-for-linux/config.json`:
                                    
```
{
  "electronCLIFlags": [
    ["force-webrtc-ip-handling-policy", "default_public_interface_only"]                                             
  ]                                                                                                                  
}
```

Could you try this on your setup and confirm whether it resolves the OnHold drops? If it does, we'll add a proper `webRTCIPHandlingPolicy` config option using Electron's `webContents.setWebRTCIPHandlingPolicy()` API, which is the stable, documented approach (the CLI flag is an internal Chromium switch that could change between versions).

Thanks in advance!

**Comment by Vagrantin** [comment]
@IsmaelMartinez ,
Thank you for the feedback will try that on the packaged version installed.
Sorry maybe I pushed the PR a bit quickly, the changes I have made did fix the issue, and it was done on 2.7.12 after I realized I was on the wrong release.
Will try your suggestion anyway and let you know.

**Comment by Vagrantin** [comment]
ok I have done the test 
added to my current config file the proposed parameter, also cannot tell for sure this is correctly taken into account:
```json
{
	"optInTeamsV2": true,
	"spellCheckerLanguages": [
		"en-GB",
		"fr-FR"
	],
  	"screenSharing.Thumbnail": {
    		"enabled": false
  	},
	"electronCLIFlags": [
	  ["force-webrtc-ip-handling-policy", "default_public_interface_only"]
	]
}

``` 

here is the startup of teams
```
teams-for-linux 
Using user configuration
all good with screenSharingThumbnail you aren't using them
all good with disableAutogain you aren't using them
all good with screenLockInhibitionMethod you aren't using them
all good with ssoInTuneEnabled you aren't using them
all good with ssoInTuneAuthUser you aren't using them
all good with videoMenu you aren't using them
Initialising logger with config: {"transports":{"console":{"level":"info"},"file":{"level":false}}}
18:37:38.277 › configPath: /home/[USER]/.config/teams-for-linux
18:37:38.353 › [CustomNotificationManager] Initialized and listening on "notification-show-toast" channel
[44914:0318/183738.526037:ERROR:content/browser/browser_main_loop.cc:288] Gtk: gtk_widget_add_accelerator: assertion 'GTK_IS_ACCEL_GROUP (accel_group)' failed
[44914:0318/183738.526249:ERROR:content/browser/browser_main_loop.cc:288] Gtk: gtk_widget_add_accelerator: assertion 'GTK_IS_ACCEL_GROUP (accel_group)' failed
[44914:0318/183738.526335:ERROR:content/browser/browser_main_loop.cc:288] Gtk: gtk_widget_add_accelerator: assertion 'GTK_IS_ACCEL_GROUP (accel_group)' failed
[44914:0318/183738.526426:ERROR:content/browser/browser_main_loop.cc:288] Gtk: gtk_widget_add_accelerator: assertion 'GTK_IS_ACCEL_GROUP (accel_group)' failed
[44914:0318/183738.526601:ERROR:content/browser/browser_main_loop.cc:288] Gtk: gtk_widget_add_accelerator: assertion 'GTK_IS_ACCEL_GROUP (accel_group)' failed
[44914:0318/183738.527247:ERROR:content/browser/browser_main_loop.cc:288] Gtk: gtk_widget_add_accelerator: assertion 'GTK_IS_ACCEL_GROUP (accel_group)' failed
[44914:0318/183738.527303:ERROR:content/browser/browser_main_loop.cc:288] Gtk: gtk_widget_add_accelerator: assertion 'GTK_IS_ACCEL_GROUP (accel_group)' failed
[44914:0318/183738.527347:ERROR:content/browser/browser_main_loop.cc:288] Gtk: gtk_widget_add_accelerator: assertion 'GTK_IS_ACCEL_GROUP (accel_group)' failed
[44914:0318/183738.527406:ERROR:content/browser/browser_main_loop.cc:288] Gtk: gtk_widget_add_accelerator: assertion 'GTK_IS_ACCEL_GROUP (accel_group)' failed
[45081:0318/183738.528412:ERROR:media/gpu/vaapi/vaapi_wrapper.cc:1653] Installed VAAPI version is too old. min supported version: 1.17 installed version: 1.14
[44914:0318/183738.528756:ERROR:content/browser/browser_main_loop.cc:288] Gtk: gtk_widget_add_accelerator: assertion 'GTK_IS_ACCEL_GROUP (accel_group)' failed
18:37:38.536 › [QuickChat] Quick Chat feature is disabled
18:37:38.536 › [AutoUpdater] Not running as AppImage, auto-updater disabled
18:37:38.536 › [IPC Security] Channel allowlisting enabled
18:37:38.537 › [IPC Security] 56 channels allowlisted
18:37:42.635 › [CONNECTION] Sub-frame failed to load:  (code: -3)

``` 

Tcpdump still shows that the Ethernet IP is advertised on the wlo1 interface:
```
sudo tcpdump -i any -n udp port 3478
tcpdump: data link type LINUX_SLL2
tcpdump: verbose output suppressed, use -v[v]... for full protocol decode
listening on any, link-type LINUX_SLL2 (Linux cooked v2), snapshot length 262144 bytes
16:39:10.320671 wlo1  Out IP 192.168.0.1.45492 > 52.114.38.150.3478: UDP, length 20
16:39:10.321729 wlo1  Out IP 192.168.50.1.54609 > 52.114.38.150.3478: UDP, length 20
16:39:10.332151 wlo1  Out IP 192.168.0.1.45492 > 52.114.38.150.3478: UDP, length 28
16:39:10.332281 wlo1  Out IP 192.168.50.1.54609 > 52.114.38.150.3478: UDP, length 28
16:39:10.336771 wlo1  In  IP 52.114.38.150.3478 > 192.168.50.1.54609: UDP, length 32
16:39:10.339305 enx387c7603bc1f In  IP 52.114.38.150.3478 > 192.168.0.1.45492: UDP, length 32
16:39:10.348798 wlo1  In  IP 52.114.38.150.3478 > 192.168.50.1.54609: UDP, length 112
16:39:10.349276 wlo1  Out IP 192.168.50.1.54609 > 52.113.155.174.3478: UDP, length 164

``` 

hope that helps.

**Comment by IsmaelMartinez** [comment]
left a couple of small comments @Vagrantin . Thanks a lot!

**Comment by IsmaelMartinez** [comment]
this has been released in https://github.com/IsmaelMartinez/teams-for-linux/releases/tag/v2.7.13 . Thanks again!
